Title,Director,NGH Cast,Genre,Sources
Aap Aye Bahaar Ayee,Mohan Kumar,"Rajendra Kumar,Sadhna, Prem Chopra",Comedy,
Adhikar,S.M. Sagar,"Ashok Kumar, Nanda, Deb Mukherjee, Pran",Drama,
Albela,A. Shamsheer,"Mehmood, Aruna Irani",Drama,
Amar Prem,Shakti Samanta,"Rajesh Khanna, Sharmila Tagore",Romance,[to be deleted 1972 movie]
Anand,Hrishikesh Mukherjee,"Rajesh Khanna, Amitabh Bachchan, Ramesh Deo, Sunita Sanyal",Drama,
Andaz,Ramesh Sippy,"Shammi Kapoor, Hema Malini, Rajesh Khanna",Drama,
Anubhav,Basu Bhattacharya,"Tanuja, Sanjeev Kumar",Drama,
Badnam Basti,Prem Kapoor,"Nitin Sethi, Nadita Thakur",Drama,
Badnam Farishte,,Sharmila Tagore,Drama,
Balidaan,,"Saira Banu, Manoj Kumar",Drama,
Banphool,Vijay Bhatt,"Jeetendra, Babita, Shatrughan Sinha",Romance,
Beharoopia,Rajesh Nanda,Helen,Drama,
Bikhare Moti,Tapi Chanakya,"Jeetendra, Babita",Romance,
Buddha Mil Gaya,Hrishikesh Mukherjee,"Navin Nischol, Om Prakash, Archana",Drama,
Caravan,Nasir Hussain,"Jeetendra, Asha Parekh, Aruna Irani",Romance,
Chaahat,Homi Bhattacharya,"Jeetendra, Mumtaz, Mala Sinha",Romance,
Chhoti Bahu,K.B. Tilak,"Rajesh Khanna, Sharmila Tagore",Drama,
Do Boond Pani,Khwaja Ahmad Abbas,"Simi Garewal, Madhu Chanda, Jalal Agha",Drama,
Do Raha,,"Shatrughan Sinha, Anil Dhawan",Drama,
Door Ka Raahi,Kishore Kumar,"Tanuja, Kishore Kumar, Ashok Kumar",Drama,
Dost Aur Dushman,Kewal Mishra,"Shatrughan Sinha, Rekha, Vinod Khanna",Drama,
Dushman,Dulal Guha,"Rajesh Khanna, Meena Kumari, Mumtaz",Drama,
Ek Nari Ek Brahmachari,Kotayya Pratyagatma,"Jeetendra, Mumtaz, Aruna Irani",Comedy,
Ek Paheli,Naresh Kumar,"Sanjeev Kumar, Feroz Khan, Aruna Irani",Thriller,
Elaan,K. Ramanlal,"Vinod Mehra, Vinod Khanna, Rekha, Madan Puri",Thriller,
Ek Thi Reeta,Roop K. Shorey,"Vinod Mehra, Tanuja, I. S. Johar, Rehman, Daisy Irani, Faryal, Lolita Chatterjee",Drama,
Gambler,Amarpreet,"Dev Anand, Zaheeda, Shatrughan Sinha, Zahira",Thriller,
Ganga Tera Pani Amrit,,"Nirupa Roy, Narendra Nath, Pran",Drama,
Guddi,Hrishikesh Mukherjee,"Dharmendra, Jaya Bhaduri, Pran",Romance,
Haathi Mere Saathi,M.A. Thirumugham,"Rajesh Khanna, Tanuja",Romance,
Hare Rama Hare Krishna,Dev Anand,"Dev Anand, Zeenat Aman, Mumtaz, Prem Chopra, RajendraNath",Drama,
Haseenon Ka Devata,Ravikant Nagaich,"Sanjay Khan, Rekha, Helen",Drama,
Hulchul,O. P. Ralhan,"Prem Chopra, kabir bedi, zeenat aman, Helen, Madan Puri",Thriller,
Hum Tum Aur Woh,Shiv Kumar,"Vinod Khanna, Bharathi",Drama,
Hungama,,"Kishore Kumar, Vinod Khanna, Mumtaz",Comedy,
Jaane-Anjaane,Shakti Samanta,"Shammi Kapoor, Vinod Khanna, Leena Chandavarkar",Drama,
Jai Bangladesh,I. S. Johar,"Kabari Choudhury, Dilip Dutt",Drama,
Jai Jawan Jai Makan,Vishram Bedekar,"Jaya Bhadhuri, Anil Dhawan",Drama,
Jal Bin Machhli Nritya Bin Bijli,Rajaram Vankudre Shantaram,"Dina Pathak, Abhijeet",Romance,
Jawan Mohabbat,Bhappi Sonie,"Shammi Kapoor, Asha Parekh, Mumtaz, Pran",Romance,
Johar Mehmood in Hong Kong,S.A. Akbar,"Mehmood, Aruna Irani, Pran",Comedy,
Jwala,M.V. Raman,"Sunil Dutt, Madhubala, Pran",Action,
Kabhi Dhoop Kabhi Chhaon,Chandrakant,"Dara Singh, Ameeta",Drama,
Kahin Aar Kahin Paar,,"Joy Mukherjee, Nadira",Romance,
Kal Aaj Aur Kal,Randhir Kapoor,"Prithviraj Kapoor, Raj Kapoor, Randhir Kapoor, Babita",Drama,
Kangan,K.B. Tilak,"Aruna Irani, Mala Sinha, Sanjeev Kumar",Drama,
Kathputli,Brij,"Jeetendra, Mumtaz",Romance,
Khoj,Jugal Kishore,"Farida Jalal, Shatrughan Sinha",Drama,
Ladki Pasand Hai,C.L. Rawal,Mumtaz,Drama,
Lagan,Ramanna,Prem Chopra,Drama,
Lakhon Mein Ek,S.S. Balan,"Aruna Irani, Mehmood, Pran",Comedy,
Lal Patthar,Sushil Majumdar,"Raj Kumar, Hema Malini, Raakhee, Vinod Mehra",Romance,
Main Sunder Hoon,R. Krishnan,"Mehmood, Leena Chandavarkar",Drama,
Man Mandir,Tapi Chanakya,"Sanjeev Kumar, Waheeda Rehman, Rakesh Roshan",Drama,
Man Tera Tan Mera,B. R. Ishara,Rehana Sultan,Drama,
Maryada,Aravind Sen,"Rajesh Khanna, Mala Sinha, Pran",Romance,
Mehboob Ki Mehndi,Harnam Singh Rawail,"Rajesh Khanna, Leena Chandavarkar",Romance,
Mela,Prakash Mehra,"Sanjay Khan, Mumtaz, Feroz Khan",,
Memsaab,Atma Ram,"Vinod Khanna, Yogeeta Bali",Drama,
Mera Gaon Mera Desh,Raj Khosla,"Asha Parekh, Dharmendra, Vinod Khanna",Drama,
Mere Apne,Gulzar,"Meena Kumari, Vinod Khanna, Shatrughan Sinha",Drama,
Naya Zamana,Pramod Chakravorty,"Dharmendra, Hema Malini, Ashok Kumar, Pran",Romance,
Paras,C.P. Dixit,"Sanjeev Kumar, Shatrughan Sinha, Raakhee",Drama,
Paraya Dhan,Rajendra Bhatia,"Hema Malini, Rakesh Roshan, Balraj Sahni",Drama,
Parde Ke Peechey,K. Shankar,"Yogeeta Bali, Bindu, Pran",Drama,
Parwana,Jyoti Swaroop,"Amitabh Bachchan. navin nischal, Yogeeta Bali",,
Patanga,Kedar Kapoor,"Shashi Kapoor Vimi, Zeb Rehman",Drama,
Phir Bhi,Shivendra Sinha,"Pratap Sharma, Urmila Bhatt, Suresh Oberoi",Drama,
Preet Ki Dori,,"Parikshit Sahni, Tanuja",Drama,
Preetam,Bhappi Sonie,"Shammi Kapoor, Leena Chandavarkar",Romance,
Pyar Ki Kahani,Ravikant Nagaich,"Amitabh Bachchan, Tanuja, Mala Sinha",Drama,
Rakhwala,Adurthi Subba Rao,"Dharmendra, Leena Chandavarkar",Romance,
Ramu Ustad,Mohammed Hussain,"Madan Puri, Dara Singh",Drama,
Reshma Aur Shera,Sunil Dutt,"Sunil Dutt, Waheeda Rehman, Amitabh Bachchan",,
Saat Sawal,Babubhai Mistry,Johnny Whisky,Drama,
Saaz Aur Sanam,JBH Wadia,"Rekha, Premendra",Romance,
Sanjog,S.S. Balan,"Amitabh Bachchan, Mala Sinha",Comedy,
Sansar,Dilip Bose,"Anupama, Nirupa Roy",Drama,
Seema,Surendra Mohan,"Kabir Bedi, Simi Garewal, Rakesh Roshan, Bharati, Padma Khanna, Abhi Bhattacharya",Drama,
Sharmeelee,Samir Ganguly,"Shashi Kapoor, Raakhee",Romance,
Shri Krishna Leela,Homi Wadia,"Sachin, Hina, Jayshree Gadkar, Sapru, Manhar Desai, Tabassum",Religious,
Tere Mere Sapne,Vijay Anand,"Dev Anand, Vijay Anand, Mumtaz, Hema Malini, Tabassum, Agha",,
Tulsi Vivah,Chandrakant,"Abhi Bhattacharya, Dara Singh, Randhawa, Jayshree Gadkar, Anita Guha","Mythology, Religious, Drama",
Umeed,Nitin Bose,"Ashok Kumar, Joy Mukherjee, Leela Naidu, Nanda, Leela Mishra, Tun Tun","Family, Social, Drama",
Upaasna,Mohan,"Sanjay Khan, Mumtaz, Feroz Khan, Helen, Anwar Hussain",Drama,
Uphaar,Sudhendu Roy,"Jaya Badhuri, Swarup Dutt, Kamini Kaushal, Suresh Chatwal, Leela Mishra","Family, Drama",
Woh Din Yaad Karo,K. Amarnath,"Sanjay Khan, Nanda, Mehmood, Madan Puri, Shashikala, Tun Tun, Wasti, Jayshree T.",Drama,
