Title,Genre,Director,Cast
Players,"Action, Thriller",Abbas-Mustan,"Abhishek Bachchan, Sonam Kapoor, Bipasha Basu, Neil Nitin Mukesh, Bobby Deol, Omi Vaidya, Sikander Kher[2]"
Chaalis Chauraasi 4084,"Comedy, Crime",Hriday Shetty,"Naseeruddin Shah, Atul Kulkarni, Kay Kay Menon, Ravi Kissen[3]"
Ghost,"Adult, Horror",Puja Jatinder Bedi,"Shiney Ahuja, Sayali Bhagat, Deepraj Rana[4]"
Sadda Adda,Comedy,Muazzam Beg,"Karanvir Sharma, Shaurya Chauhan, Bhaumik Sampat, Kahkkashan Aryan, Rohin Robert, Rohit Arora[5]"
Agneepath,"Action, Drama",Karan Malhotra,"Hrithik Roshan, Sanjay Dutt, Priyanka Chopra, Rishi Kapoor, Om Puri, Zarina Wahab[6]"
Gali Gali Chor Hai,Drama,Rumi Jaffrey,"Akshaye Khanna, Shriya Saran, Mugdha Godse, Satish Kaushik, Vijay Raaz[7]"
Staying Alive,Social,Anant Mahadevan,"Anant Mahadevan, Saurabh Shukla, Chandan Roy Sanyal[8]"
Love You To Death,Comedy,Rafeeg Ellias,"Yuki Ellias, Chandan Roy Sanyal, Sheeba Chaddha, Suhasini Mulay[9]"
Ek Main Aur Ekk Tu,"Romance, Comedy",Shakun Batra,"Imran Khan, Kareena Kapoor, Boman Irani, Ram Kapoor, Ratna Pathak Shah[10]"
Valentine's Night,"Adult, Romance, Thriller",Krishan Kumar,"Payal Rohatgi, Sangram Singh, Rahul Minz, Neha Thakur,[11]"
Ekk Deewana Tha,Romance,Gautham Menon,"Prateik Babbar, Amy Jackson, Manu Rishi, Ramesh Sippy, Sachin Khedekar[12]"
?: A question mark,"Adult, Horror","Allyson Patel
Yash Dave","Maanvi Gagroo, Akhlaque Khan, Yaman Chatwal, Varun Thakur, Chirag Jain[13]"
Married 2 America,Drama,Dilip Shankar,"Jackie Shroff, Archana Joglekar, Anjali Malhotra, Shweta Tiwari, Raghuveer Yadav, Chetan Pandit, Ashok Samarth, Akhilendra Mishra"
Jodi Breakers,Romance,Ashwini Chaudhary,"Madhavan, Bipasha Basu, Omi Vaidya, Dipannita Sharma[14]"
Tere Naal Love Ho Gaya,"Romance, Comedy",Mandeep Kumar,"Riteish Deshmukh, Genelia D'Souza, Om Puri[15]"
"London, Paris, New York",Romance,Anu Menon,"Ali Zafar, Aditi Rao Hydari[16]"
Paan Singh Tomar,Crime,Tigmanshu Dhulia,"Irrfan Khan, Mahie Gill[17]"
Will You Marry Me?,Romance,Aditya Dutt,"Shreyas Talpade, Mugdha Godse, Rajeev Khandelwal, Muzamil Ibrahim[18]"
Kahaani,"Drama, Thriller",Sujoy Ghosh,"Vidya Balan, Parambrata Chatterjee[19]"
Chaar Din Ki Chandni,Comedy,Samir Karnik,"Tusshar Kapoor, Kulraj Randhawa, Anupam Kher[19]"
Say Yes to Love,Romance,Mahrukh Mirza Beg,"Asad Mirza, Nazia Hussain, Aditya Roy Kapur[20]"
Akkad Bakkkad Bam Be Bo,Romance,Dweep Raj Kochhar,Dweep Raj Kochhar[21]
Zindagi Tere Naam,Romance,Ashu Trikha,"Mithun Chakraborthy, Ranjeeta Kaur, Ashish Sharma[21]"
Agent Vinod,"Suspense, Thriller",Sriram Raghavan,"Saif Ali Khan, Kareena Kapoor[20]"
Blood Money,Thriller,Vishal Mahadkar,"Kunal Khemu, Amrita Puri[22]"
Bumboo,Comedy,Jagdish Rajpurohit,"Sharat Saxena, Sanjay Mishra[20]"
Housefull 2,"Action, Comedy",Sajid Khan,"Akshay Kumar, Asin Thottumkal, Jacqueline Fernandez, John Abraham, Riteish Deshmukh, Zarine Khan, Shreyas Talpade, Shazahn Padamsee, Rishi Kapoor, Randhir Kapoor, Boman Irani, Mithun Chakraborty[23]"
Bittoo Boss,Comedy,Supavitra Babul,"Pulkit Samrat, Amita Pathak[24]"
Chhodo Kal Ki Baatein,Comedy,Pramod Joshi,"Sachin Khedekar, Anjan Srivastav, Atul Parchure, Anupam Kher[25]"
Ab Hoga Dharna Unlimited,Drama,Deepak Tanwar,"Sourabh Malik, Rekha Rana, Omkar Das Manikpuri[25]"
Vicky Donor,Comedy,Shoojit Sircar,"Ayushmann Khurrana, Yami Gautam, Annu Kapoor[26]"
Hate Story,"Adult, Thriller",Vivek Agnihotri,"Paoli Dam, Gulshan Devaiya, Nikhil Dwivedi[26]"
Tezz,Action,Priyadarshan,"Ajay Devgn, Anil Kapoor, Kangana Ranaut, Zayed Khan, Sameera Reddy, Boman Irani, Mohanlal[27]"
Life Ki Toh Lag Gayi (Film),Comedy,Rakesh Mehta,"Ranvir Shorey, Kay Kay Menon, Manu Rishi, Rukhsar Rehman, Neha Bhasin[27]"
Jannat 2,"Crime, Thriller",Kunal Deshmukh,"Emraan Hashmi, Randeep Hooda & Esha Gupta[28]"
Fatso!,Comedy,Rajat Kapoor,"Ranvir Shorey, Gul Panag, Purab Kohli[28]"
The Forest,Horror,Ashvin Kumar,"Ankur Vikal, Nandana Sen, Jaaved Jaaferi[28]"
"Love, Lies & Seetha",Comedy,Chandra Pemmaraju,"Melanie Kannokada, Arjun Gupta, Lavrenti Lopes[28]"
Dangerous Ishq,"Romance, Thriller",Vikram Bhatt,"Karishma Kapoor, Rajneesh Duggal, Jimmy Shergill, Divya Dutta[29]"
Ishaqzaade,Romance,Habib Faisal,"Arjun Kapoor, Parineeti Chopra[30]"
Department,"Adult, Action, Crime",Ram Gopal Varma,"Amitabh Bachchan, Sanjay Dutt, Rana Daggubati, Anjana Sukhani, Lakshmi Manchu, Naseeruddin Shah[31]"
Chhota Bheem And The Curse Of Damyaan,Animation,Rajiv Chilaka,"Voice-Over by Kaustav Ghosh, Rupa Bhimani[32]"
Mr. Bhatti on Chutti,"Comedy, Film",Karan Razdan,"Anupam Kher, Abid Ali[33]"
Arjun: The Warrior Prince,Animation,Arnab Chaudhuri,"Voice-over by Yuddvir Bakolia, Anjan Srivastav, Sachin Khedekar, Ila Arun, Vishnu Sharma[34]"
MLA,Crime,Shiv Dube,"Mukesh Tiwari, Omkar Das Manikpuri[35]"
Rakhtbeej,"Romance, Comedy",Anil Balani,"Maanas Srivastavam, Sayantani Nandi[36]"
Yeh Khula Aasmaan,Romance,Gitanjali Sinha,"Raghuveer Yadav, Yashpal Sharma[36]"
"Love, Wrinkle-free","Adult, Romance",Sandeep Mohan,"Ash Chandler, Shernaz Patel[36]"
Rowdy Rathore,"Action, Comedy",Prabhu Deva,"Akshay Kumar, Sonakshi Sinha, Paresh Ganatra, Nassar[37]"
Shanghai,"Political, Thriller",Dibakar Banerjee,"Emraan Hashmi, Abhay Deol, Kalki Koechlin, Prasenjit Chatterjee[38]"
Ferrari Ki Sawaari,"Drama, Comedy",Rajesh Mapuskar,"Sharman Joshi, Boman Irani[39]"
Qasam Se Qasam Se,Romance,Azim Rizvi,"Faith, Rakhi Sawant, Satish Kaushik, Mukesh Tiwari, Omkar Das Manikpuri[40]"
Teri Meri Kahaani,"Romance, Comedy",Kunal Kohli,"Shahid Kapoor, Priyanka Chopra, Prachi Desai[41]"
Gangs of Wasseypur,"Adult, Crime, Thriller",Anurag Kashyap,"Manoj Bajpai, Nawazuddin Siddiqui, Piyush Mishra, Richa Chadda, Huma Qureshi, Reema Sen[42]"
Maximum,Thriller,Kabeer Kaushik,"Sonu Sood, Naseeruddin Shah, Neha Dhupia, Vinay Pathak[43]"
Bol Bachchan,"Comedy, Action",Rohit Shetty,"Ajay Devgn, Abhishek Bachchan, Asin Thottumkal, Prachi Desai[44]"
3 Bachelors,Comedy,Ajay Sinha,"Sharman Joshi, Riya Sen, Raima Sen,[45]"
Cocktail,Romance,Homi Adajania,"Saif Ali Khan, Deepika Padukone, Diana Penty, Boman Irani, Dimple Kapadia[46]"
Gattu,Children,Rajan Khosa,"Sarvasva, Mohammad Samad, Naresh Kumar[47]"
Challo Driver,Comedy,Vickrant Mahajan,"Kainaz Motivala, Vickrant Mahajan, Prem Chopra, Manoj Pahwa[48]"
Mere Dost Picture Abhi Baki Hai,Comedy,Rajnish Raj Thakur,"Suniel Shetty, Rajpal Yadav[49]"
Kyaa Super Kool Hai Hum,"Adult, Comedy",Sachin Yardi,"Tusshar Kapoor, Riteish Deshmukh, Neha Sharma, Sarah-Jane Dias[50]"
Aalaap,Social,Manish Manikpuri,"Amit Purohit, Pitobash Tripathy, Gamya Wijayadasa, Rituparna Sengupta,"
Overtime,Drama,Ajay Yadav,"Swati Sharma, Yashpal Sharma, Satish Kaushik,[51]"
Jism 2,"Adult, Thriller",Pooja Bhatt,"Sunny Leone, Arunoday Singh, Randeep Hooda[52]"
Krishna Aur Kans,Animation,Vikram Veturi,"Voice-over by Om Puri, Juhi Chawla, Manoj Bajpai, Anupam Kher, A. K. Hangal, Sachin Pilgaonkar, Supriya Pilgaonkar, Prachi Save[53][54]"
Gangs of Wasseypur - Part 2,"Adult, Crime, Thriller",Anurag Kashyap,"Nawazuddin Siddiqui, Tigmanshu Dhulia, Piyush Mishra, Richa Chadda, Huma Qureshi, Reema Sen[55]"
Paanch Ghantey Mien Paanch Crore,Thriller,Faisal Saif,"Meera, Abhishek Kumar, Kavita Radheshyam"
Ek Tha Tiger,"Romance, Action",Kabir Khan,"Salman Khan, Katrina Kaif, Ranvir Shorey, Girish Karnad[56]"
Shirin Farhad Ki Toh Nikal Padi,"Romance, Comedy",Bela Sehgal,"Boman Irani, Farah Khan[57]"
Joker,Drama,Shirish Kunder,"Akshay Kumar, Sonakshi Sinha, Shreyas Talpade, Minnisha Lamba[58]"
Jalpari: The Desert Mermaid,"Thriller, Social",Nila Madhab Panda,"Rahul Singh, Suhasini Mulay, Lehar Khan, Harsh Mayar, Tannishtha Chatterjee, Parvin Dabas"
From Sydney with Love,Romance,Prateek Chakravorty,"Sharad Malhotra, Karan Sagoo, Evelyn Sharma[59]"
I M 24,Comedy,Saurabh Shukla,"Ranvir Shorey, Neha Dhupia, Saurabh Shukla, Rajat Kapoor, Karan Singh Grover, Manjari Fadnis"
Raaz 3,"Adult, Suspense, Thriller",Vikram Bhatt,"Emraan Hashmi, Bipasha Basu, Esha Gupta[60]"
Chal Pichchur Banate Hain,Comedy,Pritish Chakraborty,"Rahil Tandon, Bhavna Ruparel[61]"
Barfi!,"Romance, Comedy",Anurag Basu,"Ranbir Kapoor, Priyanka Chopra, Ileana D'Cruz[62]"
Jeena Hai Toh Thok Daal,Drama,Manish Vatsalya,"Ravi Kissen, Yashpal Sharma, Govind Namdev, Hazel, Sharat Saxena[63]"
Heroine,"Adult, Drama",Madhur Bhandarkar,"Kareena Kapoor, Arjun Rampal, Randeep Hooda, Mugdha Godse, Rakesh Bapat, Divya Dutta[64]"
Kamaal Dhamaal Malamaal,Comedy,Priyadarshan,"Paresh Rawal, Om Puri, Nana Patekar, Shreyas Talpade, Rajpal Yadav, Madhurima[65]"
Oh My God,Comedy,Umesh Shukla,"Paresh Rawal, Akshay Kumar, Mithun Chakraborty, Lubna Salim [66]"
English Vinglish,Drama,Gauri Shinde,"Sridevi, Priya Anand, Mehdi Nebbou, Amitabh Bachchan[67]"
Kismet Love Paisa Dilli,Comedy,Sanjay Khanduri,"Vivek Oberoi, Mallika Sherawat[68]"
Aiyyaa,"Romance, Comedy",Sachin Kundalkar,"Rani Mukerji, Prithviraj Sukumaran[69]"
Makkhi,"Action, Fantasy",S S Rajamouli,"Sudeep, Nani, Samantha[70]"
Login,"Drama, Thriller",Sanjeev Reddy,"Himansu Bhatt, Radhika Roy, Akkash Basant, Rashmi Gautam, Nandini Rai,[71]"
Chittagong (film),Drama,Bedabrata Pain,"Manoj Bajpai, Vega Tamotia, Nawazuddin Siddiqui, Barry John[72]"
Bhoot Returns,Horror,Ram Gopal Verma,"Manisha Koirala, J. D. Chakravarthy[73]"
Student Of The Year,"Romance, Comedy",Karan Johar,"Siddharth Malhotra, Alia Bhatt, Varun Dhawan, Rishi Kapoor[74]"
Delhi Safari,Animation,Nikhil Advani,"Voice-Over By Akshaye Khanna, Suniel Shetty, Urmila Matondkar, Boman Irani, Govinda, Swini Khara[75]"
Chakravyuh,"Political, Thriller",Prakash Jha,"Arjun Rampal, Abhay Deol, Esha Gupta, Manoj Bajpai, Kabir Bedi[76]"
Ajab Gazabb Love,Comedy,Sanjay Gadhvi,"Jackky Bhagnani, Nidhi Subbaiah, Arjun Rampal, Darshan Jariwala, Kirron Kher[77]"
Rush,"Thriller, Crime","Shamin Desai, Priyanka Desai","Emraan Hashmi, Neha Dhupia, Sagarika Ghatge, Aditya Pancholi[78]"
Luv Shuv Tey Chicken Khurana,Comedy,Sameer Sharma,"Kunal Kapoor, Huma Qureshi[79]"
1920 - Evil Returns,Horror,Bhushan Patel,"Aftab Shivdasani, Tia Bajpai, Vidya Malvade[80]"
Ata Pata Laapata,"Musical, Comedy",Rajpal Yadav,"Rajpal Yadav, Ashutosh Rana, Asrani[81]"
Sons Of Ram,"Animation, Drama, Children",Kushal Ruia,"Voice over by Sunidhi Chauhan, Aditya Kapadia, Devansh Doshi, Saptharishi Ghosh[82]"
Future To Bright Hai Ji,Drama,Sanjay Amar,"Aamir Bashir, Sonal Sehgal, Satish Kaushik[83]"
Jab Tak Hai Jaan,"Romance, Drama",Yash Chopra,"Shahrukh Khan, Katrina Kaif, Anushka Sharma[84]"
Son Of Sardaar,Comedy,Ashwni Dhir,"Ajay Devgn, Sonakshi Sinha, Sanjay Dutt, Juhi Chawla[85]"
Talaash,"Drama, Suspense",Reema Kagti,"Aamir Khan, Rani Mukerji, Kareena Kapoor, Nawazuddin Siddiqui[86]"
Khiladi 786,"Action, Comedy",Ashish R Mohan,"Akshay Kumar, Asin Thottumkal, Mithun Chakraborty, Raj Babbar, Himesh Reshammiya, Paresh Rawal[87]"
Cigarette Ki Tarah,"Drama, Thriller",Akashaditya Lama,"Bhoop Yaduvanshi, Prashant Narayanan, Madhurima Tuli, Sudesh Berry,[88]"
Dabangg 2,"Action, Comedy",Arbaaz Khan,"Salman Khan, Sonakshi Sinha, Arbaaz Khan, Prakash Raj, Vinod Khanna[89]"
